{
  "schemaVersion": "1.0",
  "tool": {
    "name": "pdf2editable-ppt",
    "version": "0.1.0"
  },
  "source": {
    "path": "/home/user/PDF_TO_editable_PPT/fixtures/pdf/scanned.pdf",
    "sha256": "a8de0326578d625c16e5f4e91558827825d7a9ac9d39d2cb00b1e2a4aac5d9be",
    "pages": 1
  },
  "output": {
    "path": "/home/user/PDF_TO_editable_PPT/samples/scanned.pptx",
    "sha256": "9f959008e06e37a59ad0a88dcce2e956a21234362a8fdbea5245d421318c687c"
  },
  "options": {
    "mode": "fidelity",
    "verify": true,
    "dpi": 150.0,
    "fallbackDpi": 220.0,
    "vectorBudget": 900,
    "detectTables": true,
    "pages": "all"
  },
  "summary": {
    "pages": 1,
    "elements": 1,
    "byOutcome": {
      "native": 1
    },
    "imagesPassedThrough": 0,
    "imagesReEncoded": 1,
    "textIntegrity": {
      "sourceChars": 0,
      "outputChars": 0,
      "identical": true,
      "textElementsRasterised": 0,
      "note": "counts ignore whitespace and use NFC normalisation; a difference is expected only where text was deliberately kept as a rendered region"
    }
  },
  "warnings": [
    "page 1 looks like a scan (a single bitmap covers 100% of the page and there are 0 text characters); the bitmap is kept intact and no text is invented over it"
  ],
  "assets": [
    {
      "assetId": "img0001",
      "format": "png",
      "widthPx": 1275,
      "heightPx": 1650,
      "passthrough": false,
      "sourceSha256": "8f5af700a2d018e630d80dacfdbfe417cde7d633460e808c311fcc9b53f1f4fb",
      "outputSha256": "00c360a03164237f5ed1d82a714316fa4a17b91983dab2a1fabc1ab091e0f8aa",
      "hasAlpha": false,
      "note": "decoded once and written as lossless PNG"
    }
  ],
  "pages": [
    {
      "index": 0,
      "pageNumber": 1,
      "widthPt": 612.0,
      "heightPt": 792.0,
      "rotation": 0,
      "scanned": true,
      "degraded": false,
      "elements": [
        {
          "id": "p1-img1",
          "type": "image",
          "outcome": "native",
          "confidence": 1.0,
          "zIndex": 1,
          "sourcePaintOrder": 1,
          "bboxPt": [
            0.0,
            0.0,
            612.0,
            792.0
          ],
          "assetId": "img0001",
          "notes": [
            "decoded once and written as lossless PNG",
            "scanned page: the source bitmap is placed unchanged, no text is reconstructed over it"
          ]
        }
      ],
      "verification": {
        "pass": true,
        "detail": "within tolerance",
        "metrics": {
          "ink_missing": 0.0,
          "ink_added": 0.0,
          "edge_iou": 0.98889,
          "mean_delta": 1.80003,
          "source_ink_ratio": 0.09568,
          "width": 1275.0,
          "height": 1651.0
        },
        "dpi": 150.0
      }
    }
  ]
}
