{
  "schemaVersion": "1.0",
  "tool": {
    "name": "pdf2editable-ppt",
    "version": "0.1.0"
  },
  "source": {
    "path": "/home/user/PDF_TO_editable_PPT/fixtures/pdf/table_borderless.pdf",
    "sha256": "c75613726f7a65d4a9ab9276bdebbad648e9c5049150dc3246e924aa98eceb5c",
    "pages": 1
  },
  "output": {
    "path": "/home/user/PDF_TO_editable_PPT/samples/table_borderless.pptx",
    "sha256": "bd92fb6428ae0fcf56c13ed6b0a765ee4f92f82277c9bf5eddade4f7616600bf"
  },
  "options": {
    "mode": "fidelity",
    "verify": true,
    "dpi": 150.0,
    "fallbackDpi": 220.0,
    "vectorBudget": 900,
    "detectTables": true,
    "pages": "all"
  },
  "summary": {
    "pages": 1,
    "elements": 13,
    "byOutcome": {
      "native": 13
    },
    "imagesPassedThrough": 0,
    "imagesReEncoded": 0,
    "textIntegrity": {
      "sourceChars": 113,
      "outputChars": 113,
      "identical": true,
      "textElementsRasterised": 0,
      "note": "counts ignore whitespace and use NFC normalisation; a difference is expected only where text was deliberately kept as a rendered region"
    }
  },
  "warnings": [],
  "assets": [],
  "pages": [
    {
      "index": 0,
      "pageNumber": 1,
      "widthPt": 612.0,
      "heightPt": 792.0,
      "rotation": 0,
      "scanned": false,
      "degraded": false,
      "elements": [
        {
          "id": "p1-txt1",
          "type": "text",
          "outcome": "native",
          "confidence": 1.0,
          "zIndex": 1,
          "sourcePaintOrder": 1,
          "bboxPt": [
            56.0,
            734.96,
            210.83,
            753.86
          ],
          "textChars": 23,
          "lines": 1
        },
        {
          "id": "p1-txt2",
          "type": "text",
          "outcome": "native",
          "confidence": 1.0,
          "zIndex": 24,
          "sourcePaintOrder": 24,
          "bboxPt": [
            56.0,
            696.04,
            78.62,
            710.89
          ],
          "textChars": 4,
          "lines": 1
        },
        {
          "id": "p1-txt3",
          "type": "text",
          "outcome": "native",
          "confidence": 1.0,
          "zIndex": 28,
          "sourcePaintOrder": 28,
          "bboxPt": [
            220.0,
            696.04,
            254.23,
            710.89
          ],
          "textChars": 5,
          "lines": 1
        },
        {
          "id": "p1-txt4",
          "type": "text",
          "outcome": "native",
          "confidence": 1.0,
          "zIndex": 33,
          "sourcePaintOrder": 33,
          "bboxPt": [
            380.0,
            696.04,
            413.62,
            710.89
          ],
          "textChars": 6,
          "lines": 1
        },
        {
          "id": "p1-txt5",
          "type": "text",
          "outcome": "native",
          "confidence": 1.0,
          "zIndex": 39,
          "sourcePaintOrder": 39,
          "bboxPt": [
            56.0,
            670.04,
            125.07,
            684.89
          ],
          "textChars": 13,
          "lines": 1
        },
        {
          "id": "p1-txt6",
          "type": "text",
          "outcome": "native",
          "confidence": 1.0,
          "zIndex": 52,
          "sourcePaintOrder": 52,
          "bboxPt": [
            220.0,
            670.04,
            256.67,
            684.89
          ],
          "textChars": 7,
          "lines": 1
        },
        {
          "id": "p1-txt7",
          "type": "text",
          "outcome": "native",
          "confidence": 1.0,
          "zIndex": 59,
          "sourcePaintOrder": 59,
          "bboxPt": [
            380.0,
            670.04,
            406.29,
            684.89
          ],
          "textChars": 4,
          "lines": 1
        },
        {
          "id": "p1-txt8",
          "type": "text",
          "outcome": "native",
          "confidence": 1.0,
          "zIndex": 63,
          "sourcePaintOrder": 63,
          "bboxPt": [
            56.0,
            644.04,
            127.52,
            658.89
          ],
          "textChars": 14,
          "lines": 1
        },
        {
          "id": "p1-txt9",
          "type": "text",
          "outcome": "native",
          "confidence": 1.0,
          "zIndex": 77,
          "sourcePaintOrder": 77,
          "bboxPt": [
            220.0,
            644.04,
            249.96,
            658.89
          ],
          "textChars": 6,
          "lines": 1
        },
        {
          "id": "p1-txt10",
          "type": "text",
          "outcome": "native",
          "confidence": 1.0,
          "zIndex": 83,
          "sourcePaintOrder": 83,
          "bboxPt": [
            380.0,
            644.04,
            435.02,
            658.89
          ],
          "textChars": 11,
          "lines": 1
        },
        {
          "id": "p1-txt11",
          "type": "text",
          "outcome": "native",
          "confidence": 1.0,
          "zIndex": 94,
          "sourcePaintOrder": 94,
          "bboxPt": [
            56.0,
            618.04,
            137.31,
            632.89
          ],
          "textChars": 16,
          "lines": 1
        },
        {
          "id": "p1-txt12",
          "type": "text",
          "outcome": "native",
          "confidence": 1.0,
          "zIndex": 110,
          "sourcePaintOrder": 110,
          "bboxPt": [
            220.0,
            618.04,
            252.39,
            632.89
          ],
          "textChars": 6,
          "lines": 1
        },
        {
          "id": "p1-txt13",
          "type": "text",
          "outcome": "native",
          "confidence": 1.0,
          "zIndex": 116,
          "sourcePaintOrder": 116,
          "bboxPt": [
            380.0,
            618.04,
            419.13,
            632.89
          ],
          "textChars": 7,
          "lines": 1
        }
      ],
      "verification": {
        "pass": true,
        "detail": "within tolerance",
        "metrics": {
          "ink_missing": 0.0,
          "ink_added": 0.0,
          "edge_iou": 0.89186,
          "mean_delta": 11.49964,
          "source_ink_ratio": 0.01082,
          "width": 1275.0,
          "height": 1651.0
        },
        "dpi": 150.0
      }
    }
  ]
}
